id,title,location,location_status,status,year,area,bathrooms,bedrooms,heating_type,energy_class,price
W-02QPK3,Ático a 3 vientos con gran terraza en Eixample ,Eixample  Sant Antoni ,Excelente,Necesitarestauración,1975,203m²,2,5,BombadecalorGas,,990.000EUR
W-02QHVR,Espectacular finca modernista en Eixample Dret ,Eixample  Eixample Dreta ,Muybien,Bien,,191m²,2,4,Gas,E,885.000EUR
W-02QM6E,Dúplex rehabilitado a estrenar en Sant Martí ,SANT MARTIN  Sant Martí de Provençals ,Muybien,Renovado,1981,125m²,2,2,Bombadecalor,E,329.000EUR
W-02QG0H,Exclusivo piso familiar en el Guinardó ,Horta Guinardó  El Guinardó ,Muybien,Muybien,,108m²,2,4,Gas,,600.000EUR
W-02QPN1,Bonito piso en Sarrià con parquin y terraza ,Sarria  Sta. Amelia ,Excelente,Bien,1964,73m²,2,2,Gas,G,480.000EUR
W-02QCSB,Soleada vivienda con terraza en Avinguda Sarriá ,Sant Gervasi  Tres Torres ,Excelente,Necesitarenovaciones,1967,137m²,3,4,Gas,,830.000EUR
W-02QNPD,Piso ideal para inversores ,Sant Just - Esplugues  Esplugues - Otras ,Bien,Bien,1975,74m²,1,3,Bombadecalor,G,280.000EUR
W-02QO2O,Fantástico dúplex de 3 habitaciones con terraza ,Les Corts  Les corts ,Excelente,,2016,150m²,3,3,,,495.000EUR
W-02QPZ4,Soleado piso alto reformado en Eixample ,Eixample  Sant Antoni ,,,1975,63m²,1,2,,E,358.000EUR
W-02QHE3,Estupendo ático con terraza de 30m² ,Sant Just - Esplugues  Esplugues - Otras ,Excelente,Muybien,1969,125m²,2,3,Gas,G,395.000EUR
W-02QG59,Piso muy luminoso con vistas al mar! ,SANT MARTIN  La Vila Olímpica del Poblenou ,,,1992,140m²,2,4,Gas,,845.000EUR
W-02QBQ4,Ático dúplex con terraza en Vila de Gràcia ,Gracia  Vila de Gracia ,,Muybien,1910,63m²,1,2,,G,360.000EUR
W-02QONH,Fántastico piso reformado en el centro ,Maresme  Arenys de Mar ,Excelente,Excelente,1991,95m²,1,3,Gas,E,225.000EUR
W-02OCZR,Precioso piso con vistas al mar  Tiana ,Maresme  Tiana ,Muybien,Muybien,2009,79m²,2,3,Gas,E,380.000EUR
W-02PUB4,Piso alto y soleado cerca de Plaza Kennedy ,Sant Gervasi  Putget ,Muybien,Necesitarenovaciones,1980,100m²,2,4,Gas,,555.000EUR
W-02QLTF,Luminoso piso con vistas al parque ,Sant Gervasi  Putget ,Excelente,Muybien,1966,100m²,2,3,Gas,,520.000EUR
W-02QP32,Amplio piso en La Verneda i La Pau ,SANT MARTIN  La Verneda i la Pau ,,,,127m²,1,2,Gas,,165.000EUR
W-02QLY0,Piso alto y luminoso en Galvany ,Sant Gervasi  Galvany ,Muybien,Muybien,1964,350m²,5,5,Gas,E,1.995.000EUR
W-02QNXD,Piso a reformar en Provençals del Poblenou ,SANT MARTIN  Provençals del Poblenou ,,,,67m²,2,3,,,240.000EUR
W-02QOEL,Piso de tres habitaciones en Eixample Dret ,Eixample  Eixample Dreta ,Excelente,Excelente,1900,156m²,2,3,Gas,E,1.100.000EUR
W-02QM16,Apartamento cerca de la playa in Barceloneta ,Ciutat Vella  Barceloneta ,,,1921,44m²,1,2,,,220.000EUR
W-02PGVX,Céntrico piso funcional en Eixample Esquerra ,Eixample  Eixample Esquerra ,Muybien,Muybien,1981,89m²,2,3,BombadecalorGas,E,399.000EUR
W-02QMAA,Precioso piso al lado del mar en Barceloneta ,Ciutat Vella  Barceloneta ,Muybien,Bien,1900,32m²,1,1,,E,240.000EUR
W-02M9RM,Gran piso alto y luminoso en Gràcia ,Gracia  Vila de Gracia ,Excelente,Excelente,1944,123m²,2,3,Gas,E,570.000EUR
W-02QNJ0,Piso Alto y luminoso en la zona de Sants ,Sants - Montjuïc  La Bordeta ,Muybien,Bien,1967,73m²,1,4,,,250.000EUR
W-02QLR4,Encantador piso a estrenar en Vila de Gràcia ,Gracia  Vila de Gracia ,Excelente,Excelente,1932,79m²,1,3,Gas,E,445.000EUR
W-02QL35,Impresionante apartamento frente al mar ,SANT MARTIN  Diagonal Mar i El Front Marítim del Poblenou ,Excelente,Excelente,2009,115m²,2,3,Bombadecalor,E,1.790.000EUR
W-02QPRX,Bonito apartamento en Diagonal Mar ,SANT MARTIN  Diagonal Mar i El Front Marítim del Poblenou ,Excelente,Excelente,2003,96m²,1,2,,E,595.000EUR
W-02NYDG,Piso reformado en Hospital Clínic ,Eixample  Eixample Esquerra ,Excelente,,1965,88m²,1,2,,E,395.000EUR
W-02QFH7,Gran piso en calle Córcega ,Gracia  Camp d'en Grassot ,Excelente,Regular,1959,167m²,2,3,Gas,E,730.000EUR
W-02QIZ0,Exclusiva propiedad junto Av Madrid ,Sants - Montjuïc  SantS ,Excelente,,,146m²,2,4,,,680.000EUR
W-02QPI1,Piso con piscina y parking  El Masnou ,Maresme  Masnou ,Muybien,Muybien,2006,105m²,2,3,Gas,F,550.000EUR
W-02NUYL,Acogedor principal con amplia terraza en Londres ,Eixample  Eixample Esquerra ,Excelente,Muybien,1920,221m²,3,4,Gas,,1.350.000EUR
W-02QPK4,Espectacular piso ideal para Golden Visa ,Eixample  Sagrada Familia ,Excelente,Excelente,1970,103m²,1,2,Gas,,515.000EUR
W-02QBIW,Dúplex con encanto en Poblenou ,SANT MARTIN  El Parc i La Llacuna del Poblenou ,Excelente,Excelente,1918,186m²,3,3,Gas,E,755.000EUR
W-02Q715,Estupendo piso a reformar cerca Francesc Macià ,Les Corts  Les corts ,Excelente,Necesitarenovaciones,1954,108m²,2,3,,,535.000EUR
W-02Q71B,Piso a reformar cerca de Francesc Macià ,Les Corts  Les corts ,Excelente,Necesitarenovaciones,1954,93m²,2,3,,,450.000EUR
W-02Q71C,Piso a reformar cerca de Francesc Macià ,Les Corts  Les corts ,Excelente,Necesitarenovaciones,1954,69m²,1,3,,,380.000EUR
W-02Q71G,Piso a reformar cerca de Francesc Macià ,Les Corts  Les corts ,Excelente,Necesitarenovaciones,1954,117m²,2,3,,,660.000EUR
W-02Q71H,Piso a reformar con magnífica terraza ,Les Corts  Les corts ,Excelente,Necesitarenovaciones,1954,137m²,1,3,,,690.000EUR
W-02Q71J,Magnífico piso con gran terraza en Les Corts ,Les Corts  Les corts ,Excelente,Necesitarestauración,1954,263m²,4,5,,,1.400.000EUR
W-02QL3S,Piso exterior con balcón en calle Lepant ,Horta Guinardó  Baix Guinardó ,Bien,,1971,57m²,1,3,Bombadecalor,E,280.000EUR
W-02QFMT,Bonito piso en elegante finca de Rambla Catalunya ,Eixample  Eixample Dreta ,Excelente,Muybien,1900,182m²,2,5,Gas,E,1.450.000EUR
W-02QL3D,Luminoso piso a reformar en Montbau ,Horta Guinardó  Montbau ,,Necesitarenovaciones,1960,56m²,1,3,Gas,F,175.000EUR
W-02QLE6,Piso luminoso y reformado junto a Sant Pau ,Horta Guinardó  Baix Guinardó ,Bien,,1963,55m²,1,2,,G,289.000EUR
W-02QL7L,Elegante piso con terraza en el Born ,Ciutat Vella  Born-Ribera ,Excelente,Excelente,1936,213m²,2,3,Gas,D,995.000EUR
W-0293XW,Piso semi nuevo al lado de la playa ,SANT MARTIN  El Poblenou ,Excelente,Muybien,2005,66m²,2,2,Gas,E,398.000EUR
W-02QLR8,Piso reformado con balcón en Rosselló ,Eixample  Sagrada Familia ,Excelente,Excelente,1973,71m²,1,3,Gas,E,360.000EUR
W-02QLPI,Encantadora Planta baja Els Molins ,Maresme  Mataró ,Bien,,1962,92m²,1,3,,,225.000EUR
W-02QDUR,Bonito piso en calle Padua ,Sant Gervasi  Putget ,,,1979,107m²,2,3,Gas,D,650.000EUR
W-02P03M,Espacioso piso en zona tranquila y céntrica ,Bagés- Manresa  MANRESA ,Muybien,Muybien,1979,121m²,2,3,Gas,E,165.000EUR
W-02P8GK,Excelente piso en zona alta de Canet de Mar ,Maresme  Canet de Mar ,Excelente,Excelente,2000,85m²,1,3,Gas,,249.000EUR
W-02QLE0,Piso a estrenar junto a la Casa de les Punxes ,Eixample  Eixample Dreta ,Muybien,Muybien,1900,137m²,3,3,Bombadecalor,E,875.000EUR
W-02Q5TC,Piso con vistas despejadas en Eixample ,Eixample  Sagrada Familia ,Excelente,Bien,1970,94m²,2,3,Gas,,365.000EUR
W-02QKIW,Luminoso piso a reformar en Pedralbes ,Pedralbes  Pedralbes ,Excelente,Necesitarenovaciones,1952,93m²,1,3,,,385.000EUR
W-02QMLX,Piso para reformar cerca del Passeig Sant Joan ,Eixample  Eixample Dreta ,Muybien,Necesitarenovaciones,1976,74m²,1,1,Central,D,330.000EUR
W-02QMLT,Piso alto para reformar en calle Bruc ,Eixample  Eixample Dreta ,Muybien,Necesitarenovaciones,1976,131m²,2,3,Central,D,650.000EUR
W-02Q9YN,Acogedor piso alto y luminoso en Eixample ,Eixample  Fort Pienc ,Excelente,Regular,1929,37m²,1,2,,E,220.000EUR
W-02QHSV,Fantástico piso familiar ,Sants - Montjuïc  SantS ,Muybien,Bien,1980,122m²,2,4,Gas,E,540.000EUR
W-02QKT5,Espectacular piso de diseño en Gràcia ,Gracia  Vila de Gracia ,,Excelente,1975,89m²,2,3,Gas,E,450.000EUR
W-02QLZX,Bonita y cómoda planta baja-dúplex sin cédula ,Ciutat Vella  Born-Ribera ,Muybien,Muybien,1936,60m²,2,1,,,190.000EUR
W-02QKD8,Piso reformado con terraza junto calle Escorial ,Gracia  Gracia Nova ,Excelente,Excelente,1960,166m²,2,4,Gas,,770.000EUR
W-02OIBA,Fantástico dúplex en Tiana ,Maresme  Tiana ,Bien,Bien,2008,133m²,3,3,Central,G,470.000EUR
W-02QGA3,Dúplex familiar cerca del mar en Barceloneta ,Ciutat Vella  Barceloneta ,,,1988,117m²,2,3,,,430.000EUR
W-02QJ3R,Excelente piso cerca de Francesc Macià ,Eixample  Eixample Esquerra ,Excelente,,1965,79m²,1,3,Gas,E,475.000EUR
W-02QFDQ,Piso a estrenar junto a Plaça Francesc Macia ,Eixample  Eixample Esquerra ,Excelente,Excelente,1947,124m²,2,3,Gas,F,660.000EUR
W-02QNBA,Piso de diseño a metros de Passeig de Gràcia ,Eixample  Eixample Dreta ,Excelente,Excelente,1900,115m²,2,3,Calefaccióncentralizada,F,799.000EUR
W-02QK16,Acogedor y céntrico piso en Manresa ,Bagés- Manresa  MANRESA ,Muybien,,1997,67m²,1,2,Gas,E,120.000EUR
W-02QDTS,Piso reformado al lado de Passeig de Gràcia ,Eixample  Eixample Dreta ,Excelente,Excelente,1880,114m²,2,3,Bombadecalor,E,799.000EUR
W-02QJMA,Piso en Les Corts con parking ,Les Corts  Les corts ,Muybien,Muybien,1998,129m²,2,4,Bombadecalor,,690.000EUR
W-02H61K,Piso familiar con terraza a reformar en Gràcia ,Gracia  Vila de Gracia ,Excelente,Regular,1991,170m²,3,5,Gas,,890.000EUR
W-02QMDL,Exclusivo piso amueblado en Mallorca ,Eixample  Eixample Esquerra ,Excelente,Excelente,1990,110m²,2,2,Gas,E,680.000EUR
W-02QMRO,Piso de obra nueva en Badalona ,Badalona  Front Marítim ,Excelente,Excelente,,108m²,2,3,Pellets,A,755.000EUR
W-02QMRK,Piso de obra nueva en Badalona ,Badalona  Front Marítim ,Excelente,Excelente,2023,110m²,2,3,Sueloradiante,A,661.000EUR
W-02Q7JG,Espectacular piso con terraza en Barri Gòtic ,Ciutat Vella  Gòtic ,Excelente,Muybien,1850,71m²,1,1,Bombadecalor,E,440.000EUR
W-02QMRJ,Piso de obra nueva en Badalona ,Badalona  Front Marítim ,Excelente,Excelente,2023,110m²,2,3,Sueloradiante,A,650.000EUR
W-02QMRI,Piso de obra nueva en Badalona ,Badalona  Front Marítim ,Excelente,Excelente,2023,110m²,2,3,Sueloradiante,A,640.000EUR
W-02QMAU,Fantástico piso cerca de Plaza de España ,Sants - Montjuïc  Poble Sec ,Excelente,Muybien,1974,76m²,1,2,Bombadecalor,E,330.000EUR
W-02QMRH,Piso de obra nueva en Badalona ,Badalona  Front Marítim ,Excelente,Excelente,2023,110m²,2,3,Sueloradiante,A,619.000EUR
W-02QMRF,Piso de obra nueva en Badalona ,Badalona  Front Marítim ,Excelente,Excelente,2023,110m²,2,3,Sueloradiante,A,598.000EUR
W-02QMRD,Piso de obra nueva en Badalona ,Badalona  Front Marítim ,Excelente,Excelente,2023,110m²,2,3,Sueloradiante,A,577.000EUR
W-02QMRC,Piso de obra nueva en Badalona ,Badalona  Front Marítim ,Excelente,Excelente,2023,110m²,2,3,Sueloradiante,A,556.000EUR
W-02QL5C,Precioso piso reformado en Poble Sec ,Sants - Montjuïc  Poble Sec ,Excelente,Excelente,1879,55m²,1,2,,E,255.000EUR
W-02QHWC,Precioso piso con elementos originales en Eixample ,Eixample  Eixample Dreta ,Excelente,Muybien,1900,144m²,2,3,Gas,E,795.000EUR
W-02MIE0,Ático dúplex con terrazas en Rambla Catalunya ,Eixample  Eixample Dreta ,Excelente,Excelente,1895,222m²,3,3,Gas,F,1.850.000EUR
W-02QIZH,Ático luminoso con gran terraza en venta ,Sant Adrià de Besòs ,Muybien,Excelente,2005,104m²,2,3,Bombadecalor,G,455.000EUR
W-02QJBL,Ático dúplex en eixample cerca centro de Mataró ,Maresme  Mataró ,Bien,Bien,2004,93m²,2,3,CorrienteEléctricaBombadecalor,F,249.000EUR
W-02QG2N,Piso con licencia turistica en calle Mercader ,Hospitalet  Collblanc ,Bien,Bien,1950,65m²,1,3,,E,340.000EUR
W-02Q3Q5,Piso familiar gran terraza L´Hospitalet - Igualtat ,Hospitalet  Santa Eulalia ,Muybien,Muybien,1992,112m²,2,4,Gas,E,515.000EUR
W-02QFRI,Luminoso piso familiar en la Sagrera ,Sagrera ,Excelente,Excelente,1980,94m²,2,4,Gas,F,399.000EUR
W-02QJHE,Ático con vistas a la montaña en El Coll ,Gracia  El Coll ,Excelente,Muybien,1965,110m²,2,3,Gas,F,380.000EUR
W-02QGTC,Piso alto en Sagrada Família ,Eixample  Sagrada Familia ,Excelente,Regular,1970,82m²,1,3,,E,350.000EUR
W-02O6JI,Piso único con terraza a reformar en Eixample ,Eixample  Eixample Dreta ,Excelente,Necesitarestauración,1936,545m²,2,5,Gas,,3.200.000EUR
W-02QHTM,Piso alto standing en Les Corts - Entença ,Les Corts  Les corts ,Excelente,Excelente,1990,156m²,2,4,Gas,E,990.000EUR
W-02Q254,Espectacular piso con elementos originales en Eixample ,Eixample  Eixample Dreta ,Excelente,Excelente,1900,185m²,3,4,Gas,D,1.190.000EUR
W-02P6LM,Espectacular ático en edificio de 1769 ,Ciutat Vella  Gòtic ,Excelente,Excelente,1769,179m²,3,3,,C,2.500.000EUR
W-02Q9Y7,Excelente piso en el centro de Sant Feliu de Llobregat ,Sant Feliu De LLobregat ,,Excelente,,70m²,1,2,Central,,272.000EUR
W-02PYUB,Magnífica propiedad con bonitas vistas ,SANT MARTIN  El Parc i La Llacuna del Poblenou ,Excelente,Excelente,1975,100m²,2,4,Gas,E,425.000EUR
W-02QBIA,Impecable Piso con todas las comodidades. ,Sant Feliu De LLobregat ,,,,102m²,2,3,Gas,,467.000EUR
W-02QITU,Oportunidad en Casagemes ,Badalona  Badalona ,Muybien,Necesitarenovaciones,1975,96m²,2,3,,D,275.000EUR
W-02QH4E,Fantástico piso a actualizar en Gràcia ,Gracia  Vila de Gracia ,,,,97m²,1,3,,E,395.000EUR
W-02QL2C,Luminoso piso de 2 dormitorios con balcón ,Maresme  Montgat ,Excelente,Excelente,2022,83m²,2,2,Sueloradiante,A,440.000EUR
W-02QL1Z,Luminoso piso de 2 dormitorios con balcón ,Maresme  Montgat ,Excelente,Excelente,2022,83m²,2,2,Sueloradiante,A,440.000EUR
W-02QL1D,Piso de obra nueva con terraza cerca del mar ,Maresme  Montgat ,Excelente,Excelente,2022,83m²,2,2,Sueloradiante,A,360.000EUR
W-02QHTZ,Piso de obra nueva con terraza cerca del mar ,Maresme  Montgat ,Excelente,Excelente,2022,83m²,2,2,Sueloradiante,A,355.000EUR
W-02O4HT,Espectacular ático reformado a estrenar cerca L’Illa ,Les Corts  Les corts ,Excelente,Excelente,1944,60m²,1,2,,F,340.000EUR
W-02QEZW,Loft próximo a Avinguda Diagonal ,Gracia  Vila de Gracia ,Excelente,Muybien,1895,30m²,1,1,,E,215.000EUR
W-02OMIC,Exclusivo y lujoso piso único en el Born ,Ciutat Vella  Born-Ribera ,Excelente,Excelente,,200m²,2,4,Gas,E,1.180.000EUR
W-02OXL5,Impresionante piso en Calle Floridablanca ,Eixample  Sant Antoni ,Excelente,,1930,117m²,2,3,Central,E,670.000EUR
W-02QITC,Precioso piso en la Dreta de l'Eixample ,Eixample  Eixample Dreta ,,,,87m²,1,3,,E,395.000EUR
W-02Q52L,Amplio piso con balcón en el centro ,Sant Just - Esplugues  Esplugues - Otras ,Excelente,Necesitarestauración,1968,93m²,1,3,Gas,E,298.500EUR
W-02QEET,Piso para invertir en les Corts ,Les Corts  Maternitat ,,,1970,66m²,2,3,Gas,,269.000EUR
W-02QGR7,Piso a reformar con mucha luz natural ,Sant Just - Esplugues  Esplugues - Otras ,Muybien,Necesitarenovaciones,1973,106m²,1,4,Gas,E,279.000EUR
W-02P05R,Precioso piso esquinero en Galvany ,Sant Gervasi  Galvany ,Excelente,Muybien,1948,186m²,3,4,Gas,E,1.030.000EUR
W-02Q4D9,Exclusivo piso en Finestrelles ,Sant Just - Esplugues  Esplugues - Finestrelles ,Excelente,Muybien,1976,154m²,2,3,Gas,E,950.000EUR
W-02QDJK,Apartamento de diseño con piscina comunitaria ,Ciutat Vella  Born-Ribera ,Excelente,Excelente,1900,109m²,3,2,,E,660.000EUR
W-02PUWS,Acogedor y luminoso piso a escasos metros del centro de Sant Feliu ,Sant Feliu De LLobregat ,Bien,Bien,1973,68m²,1,3,Bombadecalor,,172.000EUR
W-02QEYC,Amplio bajo en Sants ,Sants - Montjuïc  SantS ,,Bien,,102m²,1,4,,,218.000EUR
W-02QAH1,Piso de 4 balcones en Sant Antoni ,Eixample  Sant Antoni ,Excelente,Necesitarestauración,1925,117m²,2,3,,E,470.000EUR
W-02QATR,Acogedor piso en finca regia en Eixample ,Eixample  Eixample Esquerra ,Excelente,Bien,1930,87m²,1,3,Bombadecalor,D,670.000EUR
W-02QJQG,Dúplex con terraza en Sant Feliu de Llobregat ,Sant Feliu De LLobregat ,Excelente,Excelente,2023,134m²,2,3,CorrienteEléctrica,A,595.000EUR
W-02OM4J,Bajo con jardín en Sant Feliu de Llobregat ,Sant Feliu De LLobregat ,Excelente,Excelente,2023,87m²,2,2,CorrienteEléctrica,A,485.000EUR
W-02Q4V8,Bonito piso a estrenar al lado de Plaça del Pi ,Ciutat Vella  Gòtic ,Excelente,Excelente,1850,120m²,2,3,CorrienteEléctrica,E,795.000EUR
W-02QGTE,Gran piso a reformar en Eixample Dret ,Eixample  Eixample Dreta ,Muybien,Necesitarestauración,1900,140m²,2,5,,E,750.000EUR
W-02QGTG,Gran piso a reformar en Eixample Dret ,Eixample  Eixample Dreta ,Muybien,Necesitarestauración,1900,140m²,2,5,,E,760.000EUR
W-02Q16I,Ático dúplex con mucha luz natural y vistas ,Sant Just - Esplugues  Esplugues - Otras ,Excelente,Muybien,2005,124m²,2,4,Gas,F,565.000EUR
W-02QFF2,Increíble ático con terraza en Eixample ,Eixample  Eixample Esquerra ,Excelente,Excelente,1940,100m²,2,2,BombadecalorGas,E,995.000EUR
W-02QF4D,Vivienda con gran terraza en Sant Gervasi ,Sant Gervasi  Putget ,Muybien,Excelente,1962,129m²,2,3,Gas,E,890.000EUR
W-02QGJ4,Piso para entrar y con vistas al Mar ,Maresme  Canet de Mar ,Excelente,Excelente,1976,84m²,1,3,Bombadecalor,E,228.000EUR
W-02P2KM,Gran piso cerca de Las Ramblas y del Mar ,Ciutat Vella  raval ,,,2006,110m²,2,3,Gas,,460.000EUR
W-02QIUD,Piso en primera planta en Rambla Catalunya ,Eixample  Eixample Esquerra ,Excelente,Excelente,1880,92m²,1,2,Central,C,1.150.000EUR
W-02QIUC,Piso de una habitación en Rambla Catalunya ,Eixample  Eixample Esquerra ,Excelente,Excelente,1880,61m²,1,1,Central,C,770.000EUR
W-02QIU8,Nuevo piso principal en Rambla Catalunya ,Eixample  Eixample Esquerra ,Excelente,Excelente,1880,169m²,3,2,Calefaccióncentralizada,C,1.850.000EUR
W-02FRC5,Nuevo piso principal en Rambla Catalunya ,Eixample  Eixample Esquerra ,Excelente,Excelente,1880,139m²,3,2,CentralCalefaccióncentralizada,C,1.620.000EUR
W-02QEEZ,Planta baja dúplex con terraza en Maragall ,Horta Guinardó  Baix Guinardó ,,Excelente,2022,120m²,2,2,Pellets,B,600.000EUR
W-02QEB5,Luminoso piso en Passeig de Maragall ,Horta Guinardó  Baix Guinardó ,,Excelente,2022,116m²,2,4,Pellets,B,700.000EUR
W-02QASR,Piso de cuatro habitaciones en Maragall ,Horta Guinardó  Baix Guinardó ,,Excelente,2022,116m²,2,4,Pellets,B,690.000EUR
W-02Q9DV,Atico en primera línea de mar en Vilassar ,Maresme  Vilassar de Mar ,Excelente,Muybien,1973,146m²,2,4,Gas,,580.000EUR
W-02QAN9,Piso de cuatro habitaciones en Maragall ,Horta Guinardó  Baix Guinardó ,,Excelente,2022,116m²,2,4,Pellets,B,685.000EUR
W-02QASQ,Piso de cuatro habitaciones en Maragall ,Horta Guinardó  Baix Guinardó ,,Excelente,2022,116m²,2,4,Pellets,B,680.000EUR
W-02QGAP,Piso reformado con terraza en Vila de Gràcia ,Gracia  Vila de Gracia ,,Excelente,1936,115m²,2,3,Gas,,725.000EUR
W-02PVN7,Magnifico piso en Vallcarca ,Gracia  Vallcarca- Penitents ,Muybien,Necesitarenovaciones,1965,183m²,2,5,,,685.000EUR
W-02QDFZ,Piso reformado con terraza en Vallcarca ,Gracia  Vallcarca- Penitents ,,Excelente,1972,90m²,2,2,BombadecalorGas,,597.000EUR
W-02QF78,Piso para estrenar con gran terraza en Bonanova ,Sant Gervasi  Bonanova ,Excelente,Excelente,1964,120m²,2,4,Gas,E,850.000EUR
W-02Q22F,Piso con piscina y vistas amplias en Provençals ,SANT MARTIN  Provençals del Poblenou ,,,2015,89m²,2,3,,B,539.000EUR
W-02QAJI,Exclusivo ático con vistas y gran terraza ,Sant Just - Esplugues  Mas Llui ,Muybien,Muybien,1999,190m²,3,4,Gas,,700.000EUR
W-02QHZ6,Luminoso ático con terraza en Guinardó ,Horta Guinardó ,Excelente,Excelente,1969,75m²,1,1,Bombadecalor,G,490.000EUR
W-02ME1B,Piso con bonitas vistas en el Turó de la Peira ,Nou Barris ,Bien,Bien,1973,76m²,1,3,Gas,F,265.000EUR
W-02Q9B4,Apartamento en finca reformada en el Gótico ,Ciutat Vella  Gòtic ,Excelente,Excelente,1910,79m²,2,3,Bombadecalor,D,770.000EUR
W-02Q9B2,Apartamento en finca reformada en el Gótico ,Ciutat Vella  Gòtic ,Excelente,Excelente,1910,79m²,2,3,Bombadecalor,D,740.000EUR
W-02Q9B0,Apartamento en finca reformada en el Gótico ,Ciutat Vella  Gòtic ,Excelente,Excelente,1910,79m²,2,3,Bombadecalor,D,720.000EUR
W-02Q9AU,Apartamento en finca reformada en el Gótico ,Ciutat Vella  Gòtic ,Excelente,Excelente,1910,85m²,2,2,Bombadecalor,D,790.000EUR
W-02Q9AS,Apartamento en finca reformada en el Gótico ,Ciutat Vella  Gòtic ,Excelente,Excelente,1910,85m²,2,2,Bombadecalor,D,770.000EUR
W-02Q9AG,Apartamento en finca reformada en el Gótico ,Ciutat Vella  Gòtic ,Excelente,Excelente,1910,85m²,2,2,Bombadecalor,D,750.000EUR
W-02QHHV,Dúplex con terraza en Sant Feliu de Llobregat ,Sant Feliu De LLobregat ,Excelente,Excelente,2023,134m²,2,3,CorrienteEléctrica,A,595.000EUR
W-02QHHR,Piso obra nueva en Sant Feliu de Llobregat ,Sant Feliu De LLobregat ,Excelente,Excelente,2023,90m²,2,2,CorrienteEléctrica,A,395.000EUR
W-02QHKG,Piso de obra nueva frente al mar en Badalona ,Badalona  Front Marítim ,,Excelente,,119m²,2,3,Sueloradiante,A,482.000EUR
W-02QHKD,Piso de obra nueva frente al mar en Badalona ,Badalona  Front Marítim ,,Excelente,,119m²,2,3,Sueloradiante,A,472.000EUR
W-02QHJ3,Piso de obra nueva frente al mar en Badalona ,Badalona  Front Marítim ,,Excelente,,119m²,2,3,Sueloradiante,A,526.000EUR
W-02QFV1,Piso de obra nueva frente al mar en Badalona ,Badalona  Front Marítim ,,Excelente,,119m²,2,3,Sueloradiante,A,494.000EUR
W-02QF6T,Piso de obra nueva frente al mar en Badalona ,Badalona  Front Marítim ,,Excelente,,119m²,2,3,Sueloradiante,A,472.000EUR
W-02QB6Y,Magnífico ático con terraza en zona Turó Parc ,Sant Gervasi  Turo Parc ,Excelente,Excelente,1965,223m²,4,5,Central,E,1.750.000EUR
W-02ODM6,Magnífico piso con terraza y vistas al mar ,Maresme  Vilassar de Mar ,Excelente,Bien,1972,135m²,2,4,,,395.000EUR
W-02OULV,¡Oportunidad! Espléndido piso en Travesera de Gracia ,Horta Guinardó  Baix Guinardó ,Muybien,Muybien,1945,117m²,2,4,Gas,F,390.000EUR
W-02Q9LU,Precioso ático con vistas a mar en venta ,Badalona  Front Marítim ,Excelente,Excelente,2004,167m²,2,4,Central,E,695.000EUR
W-02PYFU,Impresionante duplex en Casagemes ,Badalona  Badalona ,Excelente,Excelente,2018,129m²,3,3,Gas,B,495.000EUR
W-02Q9TJ,Dúplex encantador con entrada independiente ,Eixample  Sant Antoni ,Excelente,Muybien,1890,102m²,1,2,Bombadecalor,F,400.000EUR
W-02OVNW,Piso alto a reformar en Eixample Dret ,Eixample  Eixample Dreta ,Excelente,Necesitarestauración,1924,192m²,2,8,Gas,E,950.000EUR
W-02GCOM,Amplio piso exterior en el Born ,Ciutat Vella  Born-Ribera ,Excelente,Muybien,1900,125m²,2,3,Gas,G,562.000EUR
W-02QC4L,Ático con terraza a nivel en el Raval Alto ,Ciutat Vella  raval ,,,1898,105m²,1,2,,E,448.000EUR
W-02QD2Q,Gran y señorial piso en Laforja ,Sant Gervasi  Galvany ,Excelente,Bien,1944,267m²,3,5,Gas,D,1.290.000EUR
W-02QCTH,Bonito apartamento frente al Port Vell ,Ciutat Vella  Born-Ribera ,Excelente,Excelente,2010,77m²,2,2,,D,600.000EUR
W-02QCLC,Piso exterior y reformado en Sant Andreu ,Sant Andreu ,Bien,Bien,1997,87m²,1,3,,,180.000EUR
W-02QDBT,Piso reformado con balcón en Rambla Poblenou ,SANT MARTIN  Provençals del Poblenou ,Excelente,Excelente,1989,76m²,1,3,Gas,E,435.000EUR
W-02P2A8,Apartamento bien ubicado junto a Lesseps ,Gracia  La Salut ,Excelente,Muybien,1980,46m²,1,1,Central,F,270.000EUR
W-02G2VH,Casa familiar en Nou Barris ,Nou Barris ,Regular,Muybien,1957,286m²,3,4,BombadecalorGas,,615.000EUR
W-02GBCW,Piso muy luminoso en Poblenou ,SANT MARTIN  El Poblenou ,Excelente,Excelente,2006,126m²,2,4,Gas,,850.000EUR
W-02QDSY,Piso tranquilo para entrar a vivir ,Sant Just - Esplugues  Esplugues - Otras ,Muybien,Muybien,1979,95m²,1,3,Gas,E,270.000EUR
W-02Q9AI,Acogedor piso cerca de Plaza d’Espanya ,Sants - Montjuïc  Poble Sec ,Excelente,Muybien,1928,40m²,1,1,,G,179.000EUR
W-02M7OQ,Piso reformado junto a Sant Antoni ,Ciutat Vella  raval ,Muybien,Excelente,1900,45m²,1,1,,E,189.000EUR
W-02Q6AL,Piso al lado del Parque de Santa Amelia ,Sarria  Sta. Amelia ,Excelente,Muybien,,87m²,1,2,,G,550.000EUR
W-02PJ28,Ideal piso céntrico y con ascensor en el Gòtic ,Ciutat Vella  Gòtic ,Muybien,,1900,63m²,1,2,Gas,E,360.000EUR
W-02QC78,Ático con vistas en Eixample Dret ,Eixample  Eixample Dreta ,Muybien,Muybien,1900,57m²,1,2,Gas,E,380.000EUR
W-02PR8W,Precioso piso en finca regia en Galvany ,Sant Gervasi  Galvany ,Excelente,Excelente,1946,277m²,4,5,Gas,,1.650.000EUR
W-02Q5ZB,Espectaculares vistas en la Illa del Mar ,SANT MARTIN  Diagonal Mar i El Front Marítim del Poblenou ,Excelente,Excelente,2008,132m²,2,3,Bombadecalor,A,2.200.000EUR
W-02OF9S,Piso reformado con terraza en Font d'en Fargues ,Horta Guinardó  Font d'en Fargas ,Bien,Muybien,1967,114m²,2,3,Bombadecalor,E,545.000EUR
W-02QEXK,Piso familiar en Fabra i Puig en el barrio de Horta ,Nou Barris ,Bien,Regular,1958,82m²,1,4,,E,250.000EUR
W-02Q6L3,Ático a reformar en Plaza Sanllehy ,Gracia  La Salut ,Excelente,Muybien,1959,99m²,1,4,BombadecalorGas,E,495.000EUR
W-02Q8FR,Fantástica propiedad en el Barrio Gótico ,Ciutat Vella  Gòtic ,Excelente,Excelente,1867,176m²,2,3,Gas,D,1.045.000EUR
W-02QBGI,Piso luminoso y soleado en Gràcia ,Gracia  Vila de Gracia ,Excelente,Muybien,1900,57m²,1,2,Bombadecalor,,314.000EUR
W-02Q9ZP,Piso a estrenar de 4 habitaciones y balcón en Eixample ,Eixample  Nova Esquerra de l'Eixample ,Excelente,Muybien,1970,131m²,2,4,Gas,D,695.000EUR
W-02OYXH,Piso reformado con balcón en zona peatonal ,Sant Just - Esplugues  Sant Joan Despí ,Muybien,Muybien,1972,111m²,1,4,Gas,E,349.000EUR
W-02PXQV,Amplio loft a pasos de la plaza Cataluña ,Ciutat Vella  raval ,Muybien,Muybien,1900,45m²,1,1,,E,187.000EUR
W-02QCG1,Acogedor ático con vistas despejadas ,Sant Just - Esplugues  Sant Joan Despí ,Excelente,Muybien,1966,75m²,1,3,Gas,G,265.000EUR
W-02QB43,Piso con gran terraza junto Hospital Sant Pau ,Horta Guinardó ,Excelente,Muybien,1991,193m²,3,4,Gas,E,695.000EUR
W-02Q0V2,Precioso piso reformado en Galvany ,Sant Gervasi  Galvany ,Excelente,Excelente,1955,96m²,2,3,LongDistanceHeating,E,725.000EUR
W-02NNW1,Espectacular piso en finca regia restaurada ,Ciutat Vella  raval ,Muybien,Excelente,1936,121m²,2,3,,E,596.000EUR
W-02QAS5,Piso reformado al lado de Plaça Tetúan ,Eixample  Eixample Esquerra ,Muybien,,1930,130m²,3,3,,D,699.000EUR
W-02Q5YE,Fantástico piso en calle Reina Victòria ,Sant Gervasi  Turo Parc ,Excelente,Necesitarestauración,1961,295m²,4,5,Gas,E,1.500.000EUR
